{
  "id": "public-api-registry",
  "name": "Public API Registry",
  "version": "1.0.0",
  "visibility": "public_build_time_only",
  "generatedAt": "2026-07-03",
  "description": "Public-safe API route index for scorecard, readiness, resources, public funding categories, lead demo routes, and webhook acknowledgements.",
  "entries": [
    {
      "id": "health",
      "method": "GET",
      "path": "/api/health",
      "file": "/api/health.js",
      "visibility": "public_runtime_browser_safe",
      "surface": "system",
      "purpose": "Basic health check for public integrations and uptime monitors.",
      "auth": "none",
      "responseBoundary": "public_safe_system_metadata"
    },
    {
      "id": "version",
      "method": "GET",
      "path": "/api/version",
      "file": "/api/version.js",
      "visibility": "public_runtime_browser_safe",
      "surface": "system",
      "purpose": "Returns public API version and route inventory.",
      "auth": "none",
      "responseBoundary": "public_safe_system_metadata"
    },
    {
      "id": "public-site-data",
      "method": "GET",
      "path": "/api/public/site-data",
      "file": "/api/public/site-data.js",
      "visibility": "public_runtime_browser_safe",
      "surface": "public_site_data",
      "purpose": "Returns public-safe site data datasets or a dataset index.",
      "auth": "none",
      "responseBoundary": "public_safe_site_data"
    },
    {
      "id": "public-funding-paths",
      "method": "GET",
      "path": "/api/public/funding-paths",
      "file": "/api/public/funding-paths.js",
      "visibility": "public_runtime_browser_safe",
      "surface": "public_site_data",
      "purpose": "Returns public-safe funding path categories.",
      "auth": "none",
      "responseBoundary": "public_safe_funding_categories"
    },
    {
      "id": "public-document-checklist",
      "method": "GET",
      "path": "/api/public/document-checklist",
      "file": "/api/public/document-checklist.js",
      "visibility": "public_runtime_browser_safe",
      "surface": "public_site_data",
      "purpose": "Returns document preparation checklist by funding purpose or public family ID.",
      "auth": "none",
      "responseBoundary": "public_safe_document_prep"
    },
    {
      "id": "public-result-tier",
      "method": "GET",
      "path": "/api/public/result-tier",
      "file": "/api/public/result-tier.js",
      "visibility": "public_runtime_browser_safe",
      "surface": "public_site_data",
      "purpose": "Returns a public-safe readiness tier explanation.",
      "auth": "none",
      "responseBoundary": "public_safe_readiness_tier"
    },
    {
      "id": "resource-recommendations",
      "method": "POST",
      "path": "/api/public/resource-recommendations",
      "file": "/api/public/resource-recommendations.js",
      "visibility": "public_runtime_browser_safe",
      "surface": "public_site_data",
      "purpose": "Recommends educational resources by tier, funding purpose, or result.",
      "auth": "none",
      "responseBoundary": "public_safe_resources"
    },
    {
      "id": "public-embed-config",
      "method": "GET",
      "path": "/api/public/embed-config",
      "file": "/api/public/embed-config.js",
      "visibility": "public_runtime_browser_safe",
      "surface": "embed",
      "purpose": "Returns public-safe embed configuration and installation snippet.",
      "auth": "none",
      "responseBoundary": "public_safe_embed_config"
    },
    {
      "id": "scorecard-start-session",
      "method": "POST",
      "path": "/api/scorecard/start-session",
      "file": "/api/scorecard/start-session.js",
      "visibility": "public_runtime_browser_safe",
      "surface": "scorecard",
      "purpose": "Starts a demo/public scorecard session and returns session metadata.",
      "auth": "none",
      "responseBoundary": "public_safe_session_metadata"
    },
    {
      "id": "scorecard-submit-score",
      "method": "POST",
      "path": "/api/scorecard/submit-score",
      "file": "/api/scorecard/submit-score.js",
      "visibility": "public_runtime_browser_safe",
      "surface": "scorecard",
      "purpose": "Submits scorecard answers and returns a public-safe readiness result.",
      "auth": "none",
      "responseBoundary": "public_safe_score_result"
    },
    {
      "id": "scorecard-get-result",
      "method": "GET/POST",
      "path": "/api/scorecard/get-result",
      "file": "/api/scorecard/get-result.js",
      "visibility": "public_runtime_browser_safe",
      "surface": "scorecard",
      "purpose": "Resolves public-safe result tier guidance from a score or future result ID.",
      "auth": "none",
      "responseBoundary": "public_safe_score_result"
    },
    {
      "id": "scorecard-request-review",
      "method": "POST",
      "path": "/api/scorecard/request-review",
      "file": "/api/scorecard/request-review.js",
      "visibility": "public_runtime_browser_safe",
      "surface": "scorecard",
      "purpose": "Queues a human funding strategy review after validating consent and answers.",
      "auth": "none",
      "responseBoundary": "public_safe_review_queue"
    },
    {
      "id": "readiness-report",
      "method": "POST",
      "path": "/api/scorecard/generate-readiness-report",
      "file": "/api/scorecard/generate-readiness-report.js",
      "visibility": "public_runtime_browser_safe",
      "surface": "scorecard",
      "purpose": "Generates structured and Markdown readiness report output.",
      "auth": "none",
      "responseBoundary": "public_safe_report"
    },
    {
      "id": "match-funding-paths",
      "method": "POST",
      "path": "/api/match/funding-paths",
      "file": "/api/match/funding-paths.js",
      "visibility": "public_runtime_browser_safe",
      "surface": "matching",
      "purpose": "Returns public-safe funding path category recommendations.",
      "auth": "none",
      "responseBoundary": "public_safe_funding_categories"
    },
    {
      "id": "match-partner-fit",
      "method": "POST",
      "path": "/api/match/partner-fit",
      "file": "/api/match/partner-fit.js",
      "visibility": "public_runtime_browser_safe",
      "surface": "matching",
      "purpose": "Returns public-safe category-level fit summary without exposing partner/provider details.",
      "auth": "none",
      "responseBoundary": "public_safe_partner_fit"
    },
    {
      "id": "match-manual-review",
      "method": "POST",
      "path": "/api/match/manual-review",
      "file": "/api/match/manual-review.js",
      "visibility": "public_runtime_browser_safe",
      "surface": "matching",
      "purpose": "Determines whether public answers should be routed to human review.",
      "auth": "none",
      "responseBoundary": "public_safe_review_reasons"
    },
    {
      "id": "lead-create",
      "method": "POST",
      "path": "/api/leads/create-lead",
      "file": "/api/leads/create-lead.js",
      "visibility": "public_runtime_browser_safe",
      "surface": "lead_lifecycle",
      "purpose": "Creates a demo/server-safe lead response from applicant and answers.",
      "auth": "none",
      "responseBoundary": "public_safe_lead_summary"
    },
    {
      "id": "lead-update-status",
      "method": "POST",
      "path": "/api/leads/update-lead-status",
      "file": "/api/leads/update-lead-status.js",
      "visibility": "public_runtime_browser_safe",
      "surface": "lead_lifecycle",
      "purpose": "Updates a demo lead status and returns a safe status summary.",
      "auth": "none",
      "responseBoundary": "public_safe_lead_status"
    },
    {
      "id": "lead-route",
      "method": "POST",
      "path": "/api/leads/route-lead",
      "file": "/api/leads/route-lead.js",
      "visibility": "public_runtime_browser_safe",
      "surface": "lead_lifecycle",
      "purpose": "Returns a public-safe lead route summary based on readiness logic.",
      "auth": "none",
      "responseBoundary": "public_safe_lead_route"
    },
    {
      "id": "webhook-scorecard-submitted",
      "method": "POST",
      "path": "/api/webhooks/scorecard-submitted",
      "file": "/api/webhooks/scorecard-submitted.js",
      "visibility": "public_runtime_browser_safe",
      "surface": "webhook",
      "purpose": "Acknowledges a scorecard submission event without returning private route data.",
      "auth": "none",
      "responseBoundary": "public_safe_webhook_ack"
    },
    {
      "id": "webhook-review-requested",
      "method": "POST",
      "path": "/api/webhooks/review-requested",
      "file": "/api/webhooks/review-requested.js",
      "visibility": "public_runtime_browser_safe",
      "surface": "webhook",
      "purpose": "Acknowledges a review requested event without returning private route data.",
      "auth": "none",
      "responseBoundary": "public_safe_webhook_ack"
    },
    {
      "id": "webhook-lead-routed",
      "method": "POST",
      "path": "/api/webhooks/lead-routed",
      "file": "/api/webhooks/lead-routed.js",
      "visibility": "public_runtime_browser_safe",
      "surface": "webhook",
      "purpose": "Acknowledges a lead routed event with a public-safe route summary.",
      "auth": "none",
      "responseBoundary": "public_safe_webhook_ack"
    }
  ],
  "allowedOutput": [
    "readiness score",
    "readiness tier",
    "public funding path category",
    "document checklist",
    "educational resources",
    "human review recommendation",
    "public-safe lead route summary",
    "webhook acknowledgement"
  ],
  "blockedOutput": [
    "provider-specific routing",
    "provider IDs",
    "apply URLs",
    "affiliate URLs",
    "commission data",
    "private contacts",
    "private notes",
    "underwriting notes",
    "credentials",
    "real borrower PII"
  ]
}
